{"$id":"https://example.org/schemas/network_event.schema.json","$schema":"https://json-schema.org/draft/2020-12/schema","additionalProperties":true,"description":"Events generated by firewalls, Layer 3 switches, and managed switches: allowed or denied traffic, inter-VLAN policy violations, and network-device administrative changes. This schema defines the telemetry source shape only. Normalization, transport, correlation, and detection are handled downstream; an external SIEM performs correlation, detection, investigation, and alerting. The repository does not operate a SIEM.","properties":{"action":{"description":"Required. The enforcement decision taken on the traffic.","enum":["allow","deny"],"type":"string"},"correlation_id":{"description":"Optional. Opaque identifier for joining related events across sources.","type":"string"},"destination":{"description":"Required. Where the traffic or event was directed.","properties":{"ip":{"description":"Required. Destination IP address.","type":"string"},"port":{"description":"Optional. Destination port.","maximum":65535,"minimum":1,"type":"integer"},"zone":{"description":"Optional. Destination network zone.","type":"string"}},"required":["ip"],"type":"object"},"destination_port":{"description":"Optional. Flat alias for destination.port, for pipelines that prefer top-level fields. Use one or the other, not both.","maximum":65535,"minimum":1,"type":"integer"},"device_identity":{"description":"Optional. Endpoint or device identity where known, for example a MAC address or Intune device ID.","type":"string"},"event_type":{"description":"Required. network_policy_violation covers denied traffic and ACL or firewall policy violations. network_policy_allow covers allowed traffic logged where operationally useful. device_config_change covers VLAN, trunk, or port configuration changes. admin_access covers administrative logins to network devices.","enum":["network_policy_violation","network_policy_allow","device_config_change","admin_access"],"type":"string"},"message":{"description":"Required. Human-readable summary. Must not contain secrets, passwords, tokens, or private key material.","type":"string"},"network_zone":{"description":"Optional. Zone label used for correlation, for example AI_AUTOMATION.","type":"string"},"policy_id":{"description":"Optional. Identifier of the firewall rule or ACL ACE that made the decision, for example AI_TO_MGMT_DENY.","type":"string"},"protocol":{"description":"Optional. Transport protocol.","enum":["tcp","udp","icmp","other"],"type":"string"},"severity":{"description":"Required. Severity assigned at the source. Downstream SIEM logic may re-prioritize.","enum":["low","medium","high","critical"],"type":"string"},"source":{"description":"Required. Where the traffic or event originated.","properties":{"device":{"description":"Optional. Device that generated the event, for example firewall.example.","type":"string"},"ip":{"description":"Required. Source IP address.","type":"string"},"zone":{"description":"Optional. Source network zone, for example AI_AUTOMATION, MANAGEMENT, GUEST, CORPORATE.","type":"string"}},"required":["ip"],"type":"object"},"timestamp":{"description":"Required. RFC3339 UTC timestamp of when the event occurred, for example 2026-01-01T12:00:00Z.","format":"date-time","type":"string"},"user_identity":{"description":"Optional. Human user associated with the traffic where the device can determine one. Never include passwords or tokens.","type":"string"},"vlan":{"description":"Optional. Source VLAN ID where known.","type":"integer"},"workload_identity":{"description":"Optional. Non-human workload identity where known, for example an AI agent runner name.","type":"string"}},"required":["timestamp","event_type","severity","source","destination","action","message"],"title":"Network policy event","type":"object"}