{"action":"deny","correlation_id":"vlan-20260101-120500","destination":{"ip":"10.10.0.20","port":443,"zone":"CORPORATE"},"event_type":"network_policy_violation","message":"Guest network host attempted access to corporate resource; inter-VLAN policy violation","network_zone":"GUEST","policy_id":"GUEST_TO_CORP_DENY","protocol":"tcp","severity":"medium","source":{"device":"core1.example","ip":"10.60.0.50","zone":"GUEST"},"timestamp":"2026-01-01T12:05:00Z","vlan":60}