{"action":"deny","correlation_id":"fw-20260101-120000","destination":{"ip":"10.99.0.10","port":443,"zone":"MANAGEMENT"},"event_type":"network_policy_violation","message":"AI automation workload attempted access to management network","network_zone":"AI_AUTOMATION","policy_id":"AI_TO_MGMT_DENY","protocol":"tcp","severity":"high","source":{"device":"firewall.example","ip":"10.50.0.25","zone":"AI_AUTOMATION"},"timestamp":"2026-01-01T12:00:00Z","vlan":50,"workload_identity":"ai-agent-runner-01"}